[{"id":"a1b2c3d4e5f6","lang":"javascript","code":"function checkValue(x) {\n  if (x == null) {\n    return 'empty';\n  }\n  return 'has value';\n}\nconsole.log(checkValue(0));\nconsole.log(checkValue(undefined));","question":"What does checkValue(0) return and is the loose equality intentional here?","options":["Returns 'empty' because 0 == null is true","Returns 'has value'; x == null only matches null and undefined","Returns 'empty' because 0 is falsy","Throws a TypeError on the comparison"],"correct_idx":1,"topic":"bug","subtopic":"loose-equality","difficulty":"easy","explain":"The loose equality x == null is a well-known idiom that matches exactly null and undefined, nothing else. So checkValue(0) returns 'has value'. This tests knowledge of the one acceptable use of == in JavaScript per most style guides.","sources":["MDN-Equality_comparisons","ESLint-eqeqeq"],"iter":1},
{"id":"b2c3d4e5f6a7","lang":"javascript","code":"class Counter {\n  constructor() { this.n = 0; }\n  inc() { this.n++; return this; }\n}\nconst c = new Counter();\nconst boundInc = c.inc;\nboundInc();\nconsole.log(c.n);","question":"What is the bug when boundInc() is invoked?","options":["c.n becomes 1 because methods auto-bind in classes","TypeError: this is undefined in strict mode class body","c.n stays 0 because inc returns a new object","The class throws on construction"],"correct_idx":1,"topic":"bug","subtopic":"this-binding","difficulty":"med","explain":"Class method bodies run in strict mode, so when inc is detached and called as a plain function this is undefined, causing a TypeError on this.n++. The fix is c.inc.bind(c) or an arrow-function field. This is the classic this-binding pitfall.","sources":["MDN-this","MDN-Strict_mode"],"iter":1},
{"id":"c3d4e5f6a7b8","lang":"javascript","code":"const fns = [];\nfor (var i = 0; i < 3; i++) {\n  fns.push(function () { return i; });\n}\nconsole.log(fns.map(f => f()));","question":"What does the final console.log print?","options":["[0, 1, 2]","[3, 3, 3]","[undefined, undefined, undefined]","[0, 0, 0]"],"correct_idx":1,"topic":"bug","subtopic":"closure-loop-var","difficulty":"easy","explain":"var is function-scoped, so all closures share the same i, which is 3 after the loop. Each function returns 3. Replacing var with let creates a fresh binding per iteration and yields [0,1,2].","sources":["MDN-let","ESLint-no-loop-func"],"iter":1},
{"id":"d4e5f6a7b8c9","lang":"javascript","code":"function fetchData(cb) {\n  setTimeout(() => {\n    const data = { ok: true };\n    if (data.ok) cb(null, data);\n  }, 10);\n}\nfetchData((err, data) => {\n  if (err) console.error(err);\n  else console.log(data);\n});","question":"What is the latent bug in fetchData?","options":["The callback is never invoked when data.ok is false, leaving the caller hanging","setTimeout makes the function synchronous","The error parameter should come second","cb(null, data) leaks memory"],"correct_idx":0,"topic":"bug","subtopic":"callback-not-called","difficulty":"med","explain":"If data.ok is false the callback is never called, so callers waiting for completion will hang forever. Every code path in a node-style callback function must invoke the callback exactly once, with either an error or a value. This is a classic forgotten-callback defect.","sources":["Node.js-Error_first_callbacks"],"iter":1},
{"id":"e5f6a7b8c9d0","lang":"javascript","code":"async function loadUser(id) {\n  const res = fetch('/api/users/' + id);\n  const json = await res.json();\n  return json;\n}\nloadUser(7).then(u => console.log(u));","question":"What is the bug?","options":["fetch should not be called inside async functions","Missing await before fetch: res is a Promise, so res.json() is invalid","The template literal should use single quotes","fetch returns the parsed JSON directly so res.json() is redundant"],"correct_idx":1,"topic":"bug","subtopic":"missing-await","difficulty":"med","explain":"fetch returns a Promise, so res is a Promise, not a Response. Calling .json() on a Promise is undefined and will reject. The missing await before fetch(...) is the bug.","sources":["MDN-fetch","ESLint-require-await"],"iter":1},
{"id":"f6a7b8c9d0e1","lang":"javascript","code":"async function getAll(ids) {\n  const results = [];\n  ids.forEach(async (id) => {\n    const r = await Promise.resolve(id * 2);\n    results.push(r);\n  });\n  return results;\n}\ngetAll([1,2,3]).then(console.log);","question":"Why does getAll print an empty array?","options":["Array.prototype.forEach does not await async callbacks, so getAll returns before any push happens","Promise.resolve(id*2) returns undefined","forEach mutates its callback","async functions cannot push to arrays"],"correct_idx":0,"topic":"bug","subtopic":"promise-not-returned","difficulty":"med","explain":"Array.prototype.forEach ignores the promises returned by its async callback. The outer function returns results before any of the async callbacks complete. Use for...of with await or Promise.all(ids.map(async ...)) instead.","sources":["MDN-Array.prototype.forEach"],"iter":1},
{"id":"a7b8c9d0e1f2","lang":"javascript","code":"function sumToN(n) {\n  let total = 0;\n  for (let i = 1; i < n; i++) {\n    total += i;\n  }\n  return total;\n}\nconsole.log(sumToN(5));","question":"What bug does sumToN exhibit when asked for the sum 1..n inclusive?","options":["Off-by-one: the loop excludes n itself; it should be i <= n","Integer overflow at large n","The accumulator total should be initialized to 1","JavaScript cannot add positive integers in a loop"],"correct_idx":0,"topic":"bug","subtopic":"off-by-one","difficulty":"easy","explain":"The loop condition i < n stops before adding n, producing 1+2+3+4=10 instead of 15. The condition must be i <= n for an inclusive sum. Off-by-one errors are among the most common bug categories.","sources":["MDN-for","CWE-193"],"iter":1},
{"id":"b8c9d0e1f2a3","lang":"javascript","code":"const defaults = { theme: 'light', lang: 'en' };\nfunction makeConfig(overrides) {\n  const cfg = defaults;\n  Object.assign(cfg, overrides);\n  return cfg;\n}\nmakeConfig({ theme: 'dark' });\nconsole.log(defaults.theme);","question":"What is wrong with makeConfig?","options":["It mutates the shared defaults object because cfg is the same reference","Object.assign is deprecated","Spread should be used instead of assignment","It returns undefined because Object.assign has no return"],"correct_idx":0,"topic":"bug","subtopic":"mutating-shared-state","difficulty":"easy","explain":"cfg = defaults aliases the module-level object; Object.assign then mutates it in place. The fix is const cfg = { ...defaults, ...overrides } or Object.assign({}, defaults, overrides). Shared mutable state is a frequent source of cross-call leakage.","sources":["MDN-Object.assign"],"iter":1},
{"id":"c9d0e1f2a3b4","lang":"javascript","code":"function greet() {\n  console.log(message);\n  var message = 'hello';\n}\ngreet();","question":"What does greet() print and why?","options":["'hello' because var is hoisted with its value","undefined because var declarations are hoisted but initializations are not","ReferenceError because message is not defined","Throws TDZ error like let would"],"correct_idx":1,"topic":"bug","subtopic":"hoisting-let-vs-var","difficulty":"easy","explain":"var message is hoisted to the top of the function scope but its assignment stays where written. So message exists as undefined when logged. Using let would throw a temporal-dead-zone ReferenceError instead.","sources":["MDN-var","MDN-let"],"iter":1},
{"id":"d0e1f2a3b4c5","lang":"javascript","code":"const arr = [1, 2, 3, 4, 5];\nfor (let i = 0; i < arr.length; i++) {\n  if (arr[i] % 2 === 0) {\n    arr.splice(i, 1);\n  }\n}\nconsole.log(arr);","question":"What is the bug?","options":["splice doesn't work on numeric arrays","Mutating the array during iteration shifts indexes, so some even numbers are skipped","arr.length is cached so the loop overshoots","The mod operator returns wrong values for negative numbers"],"correct_idx":1,"topic":"bug","subtopic":"array-mutate-during-iter","difficulty":"med","explain":"After splicing index i, the next element shifts into position i, but the loop increments i, skipping it. So when 2 is removed, 3 moves to its slot but i moves past, leaving 4 to be inspected only later. Iterate backwards or use arr.filter.","sources":["MDN-Array.prototype.splice"],"iter":1},
{"id":"e1f2a3b4c5d6","lang":"javascript","code":"function parseConfig(text) {\n  const data = JSON.parse(text);\n  return data.value;\n}\nmodule.exports = { parseConfig };","question":"What defensive coding issue exists?","options":["JSON.parse can throw on malformed input; the function has no try/catch","module.exports is not supported in Node 20","JSON.parse returns a Promise","data.value is always undefined"],"correct_idx":0,"topic":"bug","subtopic":"json-parse-no-try","difficulty":"easy","explain":"JSON.parse synchronously throws SyntaxError on invalid JSON. Any function that parses untrusted input should wrap it in try/catch or document that it may throw. This is a common source of unexpected crashes in HTTP handlers.","sources":["MDN-JSON.parse"],"iter":1},
{"id":"f2a3b4c5d6e7","lang":"javascript","code":"function getName(user) {\n  if (user.name !== undefined) {\n    return user.name.toUpperCase();\n  }\n  return 'ANON';\n}\nconsole.log(getName({ name: null }));","question":"Why does getName crash on { name: null }?","options":["null is not !== undefined, so the guard passes but null.toUpperCase throws","null is implicitly converted to 'null'","toUpperCase requires a numeric argument","The object literal is malformed"],"correct_idx":0,"topic":"bug","subtopic":"undefined-vs-null","difficulty":"easy","explain":"The check user.name !== undefined lets null through, then null.toUpperCase() throws TypeError. Use user.name != null (loose) or user.name?.toUpperCase() ?? 'ANON' instead.","sources":["MDN-Equality_comparisons"],"iter":1},